Estandar;grado;periodo;id_materia oficial;nombre_dba;Evidencia de aprendizaje;Eje tematico
Explica condiciones de cambio y conservación en diversos sistemas teniendo en cuenta transferencia y transporte de energía y su interacción con la materia;6;3;2;·        1. Comprende que el movimiento de un cuerpo, en un marco de referencia inercial dado, se puede describir con gráficos y predecir por medio de expresiones matemáticas.;"•	Describe el movimiento de un cuerpo (rectilíneo uniforme y uniformemente acelerado, en dos dimensiones -circular uniforme y parabólico) en gráficos que relacionan el desplazamiento, la velocidad y la aceleración en función del tiempo.
•	Predice el movimiento de un cuerpo a partir de las expresiones matemáticas con las que se relaciona, según el caso, la distancia recorrida, la velocidad y la aceleración en función del tiempo.
•	Analizar los puntos de reciclaje que se encuentren más cercanos a la institución para predecir distancia, sentido y dirección mediante el uso de los vectores";"•	Herencia
•	El ADN 
•	Transcripción, traducción y sintesis de proteínas 
•	Las leyes de Mendel
•	Fenotipo
•	Genotipo
•	Enfermedades genéticas y mutaciones"
Establece relaciones entre las características macroscópicas y microscópicas de la materia y las propiedades físicas y químicas de las sustancias que la constituyen;7;3;2;·        1. Comprende las formas y las trasformaciones de energía en un sistema mecánico y la manera como, en los casos reales, la energía se disipa en el medio (calor, sonido).;"•	Relaciona las variables velocidad, posición para describir las formas de energía mecánica que tiene un cuerpo en movimiento.
•	Identifica las formas de energía mecánica que tienen lugar en diferentes puntos del movimiento en un sistema mecánico. 
•	Explica como el movimiento de los cuerpos presenta un tipo de energía mecánica y como esta es aprovechable 
para la obtención de electricidad en nuestras viviendas.";"•	Tipos de energía 
•	Energía mecánica
•	Cinemática (caída libre, péndulo, montaña rusa)"
Identifica  conceptos científicos fundamentales y su aplicación en el mundo real.;10;3;6; aplica los principios científicos para analizar fenómenos, resolver problemas y tomar decisiones informadas.;Los estudiantes elaboran modelos, diagramas y gráficos para representar conceptos científicos. *Los estudiantes participan en debates y discusiones científicas para defender sus ideas y evaluar las ideas de los demás;
"•	- Describe, compara y explica de manera oral o escrita concepciones de su imaginario fantástico y de las danzas del pasado y contemporáneas que involucra en sus interpretaciones";6;3;5;"•	Identifica los tipos de danza de las distintas regiones de Colombia, lo mismo que el vestuario y costumbres.
•	Asume una actitud participativa en las diversas actividades grupales ";"•	Interpreta algunos ritmos de folclore colombiano.
•	Elabora vestuario pertinente con los elementos del medio-
•	Demuestra interés, placer, goce y disfrute al observar los aportes lúdicos propios y de los demás.";"•	El ritmo
•	La coreografía "
Desarrolla la sensibilización frente a la importancia y valoración de su cuerpo como principal obra de arte;7;3;5;"•	Desarrolla habilidades comunicativas que implican dominio técnico y tecnológico.
•	Se comunica mediante mensajes corporales particularmente emotivos, de su propia evocación o invención involucrando formas y movimientos de la naturaleza y de la cultura de su comunidad, regional, nacional o universal.
•	Demuestra seguridad en sus propios juicios de valor y sensibilidad hacia el mundo al asumir una actitud crítica frente a éste";"•	Propone y disfruta de actividades grupales que incidan en la calidad de su medio ambiente.
•	Describe, compara y explica de manera oral o escrita concepciones de su imaginario fantástico y de las danzas del pasado y contemporáneas que involucra en sus interpretaciones.
•	Selecciona y transforma materiales y recursos del medio ambiente natural y cultural para realizar propuestas de montaje danzado a diferentes expresiones literarias, plásticas, escénicas, audiovisuales y demás";"•	La fantasía
•	La imaginación 
•	Danza contemporánea"
Desarrolla y expresa sensaciones, sentimientos e ideas a través de metáforas y símbolos dancísticos mediante la expresión corporal.;8;3;5;"•	Manifiesta actitud de goce ante el descubrimiento de sus condiciones de inventiva motriz y danzaría, con su propio cuerpo y en actividades de grupo.
•	Produce pequeñas propuestas de movimientos y danza de diferente índole, en torno al mundo sonoro, musical y plástico que denotan que escucha y observa, que evoca gustoso";"•	disfruta la vivencia de su entorno natural, de la producción dancística y musical de su contexto, de otras culturas y de otras épocas. 
•	Selecciona y transforma materiales y recursos del medio ambiente natural y cultural para realizar propuestas de montaje danzado a diferentes expresiones literarias, plásticas, escénicas, audiovisuales y demás para hacer coreografías sencillas.
•	Manifiesta interés, identifica y maneja los movimientos básicos de las danzas que produce, las danzas de su comunidad y las del entorno en general.";"•	La danza 
•	La coreografía "
"•	Genera apertura al diálogo pedagógico, cambios y generación de actitudes hacia la dinámica expresiva propia y del entorno";9;3;5;"•	Produce pequeñas propuestas de movimientos y danza de diferente índole, en torno al mundo sonoro, musical y plástico que denotan que escucha y observa.
•	Comunica espontáneamente los aportes de la clase de danza a su vida cotidiana y viceversa.
•	Manifiesta actitud de goce ante el descubrimiento de sus condiciones de inventiva motriz y danzaría, con su propio cuerpo y en actividades de grupo.
•	Es consciente de la posición y el movimiento de su cuerpo y del espacio en la cotidianidad y en las expresiones artísticas";"•	Reconoce, discrimina y globaliza diferentes componentes del movimiento y de la danza en función de su propia inventiva.
•	Manifiesta interés, identifica y maneja los movimientos básicos de las danzas que produce, las danzas de su comunidad y las del entorno en general.
•	Participa con la escuela en la elaboración de la historia de las danzas de la comunidad.";"•	Historia de la danza
•	El movimiento en la danza"
·        Utiliza modelos biológicos, físicos y químicos para explicar la transformación y conservación de la energía;10;3;5;"•	2. Comprende la conservación de la energía mecánica como un principio que permite cuantificar y explicar diferentes fenómenos mecánicos";"•	Predice cualitativa y cuantitativamente el movimiento de un cuerpo al hacer uso del principio de conservación de la energía mecánica en diferentes situaciones físicas.

•	Predice el movimiento de un cuerpo a partir de las expresiones matemáticas con las que se relaciona, según el caso, la distancia recorrida, la velocidad y la aceleración en  función del tiempo";"•	Sistemas de referencia
•	Vectores y suma de vectores.
•	Unidades vectoriales y escalares.
•	Movimiento rectilíneo uniforme, uniformemente acelerado
•	Calculo de velocidad, posición, aceleración y tiempo.
•	Movimiento circular uniforme"
"•	Desarrolla sensaciones, sentimientos e ideas a través de metáforas y símbolos dancísticos mediante la expresión corporal";11;3;5;"•	Controla, orienta y ensaya nuevas habilidades corporales que le permitan, con relativa facilidad, la ejecución de pasos y esquemas expresivos.
•	Describe, compara y explica de manera oral o escrita concepciones de su imaginario fantástico y de las danzas del pasado y contemporánea.
•	Manifiesta interés, identifica y maneja los movimientos básicos de las danzas que produce, las danzas de su comunidad y las del entorno en general.";"•	Muestra que conoce y valora su entorno cultural en actividades teóricas o prácticas de índole investigativa a través de consultas.
•	Se involucra gustoso en actividades grupales que acrecientan su aprecio por el patrimonio cultural.
•	Es consciente de la posición y el movimiento de su cuerpo y del espacio en la cotidianidad y en las expresiones artísticas.
•	Produce pequeñas propuestas de movimientos y danza de diferente índole, en torno al mundo sonoro, musical y plástico que denotan que escucha y observa con relación al medio ambiente.";"•	El baile
•	La danza
•	La música
•	El ritmo"
"Utilizo números racionales, en sus distintas expresiones
(fracciones, razones, decimales o porcentajes) para resolver
problemas en contextos de medida.";6;3;1;Interpreta los números enteros y racionales (en sus representaciones de fracción y de decimal) con sus operaciones, en diferentes contextos, al resolver problemas de variación, repartos, particiones, estimaciones, etc. Reconoce y establece diferentes relaciones (de orden y equivalencia y las utiliza para argumentar procedimientos).;"*Resuelve problemas en los que intervienen cantidades positivas y negativas en procesos de comparación, transformación y representación
.*Propone y justifica diferentes estrategias para resolver problemas con números enteros, racionales (en sus representaciones de fracción y de decimal) en contextos escolares y extraescolares. 
Representa en la recta numérica la posición de un número utilizando diferentes estrategias. 
Interpreta y justifica cálculos numéricos al solucionar problemas.";Fracciones positivas y sus aplicaciones ,números decimales y fracciones, números fraccionarios positivos, simplificación de fracciones, operaciones con las fracciones, 
"Justifico el uso de representaciones y procedimientos en
situaciones de proporcionalidad directa e inversa

Analizo las propiedades de correlación
positiva y negativa entre
variables, de variación lineal o de
proporcionalidad directa y de proporcionalidad
inversa en contextos
aritméticos y geométricos.

• Justifico la pertinencia de un cálculo exacto o aproximado
en la solución de un problema y lo razonable o no de las
respuestas obtenidas.


Conjeturo acerca del resultado de
un experimento aleatorio usando
proporcionalidad y nociones básicas
de probabilidad.";7;3;1;"Identifica y analiza propiedades de covariación directa e inversa entre variables, en contextos numéricos, geométricos y cotidianos y las representa mediante gráficas (cartesianas de puntos, continuas, formadas por segmentos, etc.).


Compara características compartidas por dos o más poblaciones o características diferentes dentro de una misma población para lo cual seleccionan muestras, utiliza representaciones gráficas adecuadas y analiza los resultados obtenidos usando conjuntamente las medidas de tendencia central y el rango.


A partir de la información previamente obtenida en repeticiones de experimentos aleatorios sencillos, compara las frecuencias esperadas con las frecuencias observadas.";Propone patrones de comportamiento numéricos y expresa verbalmente o por escrito los procedimientos matemáticos. m Realiza cálculos numéricos, organiza la información en tablas, elabora representaciones gráficas y las interpreta. m Trabaja sobre números desconocidos y con esos números para dar respuestas a los problemas;"Proporcionalidad, razones y proporciones, proporcionalidad directa, proporcionalidad inversa, resolución de problemas con reglas de tres simple directa, simple inversa, regla de tres compuesta, resolución de problemas con reglas de tres.
Estadística y probabilidad, caracterización de variables cuantitativas, caracterización en forma agrupada, caracterización en forma no agrupada, teoría de la probabilidad, probabilidad simple, propiedades de la probabilidad, principio de multiplicación, caracterización de datos y probabilidad"
"Modelo situaciones de variación
con funciones polinómica, 

Construyo expresiones algebraicas
equivalentes a una expresión algebraica
dada.
";8;3;1;"
Reconoce los diferentes usos y significados de las operaciones (convencionales y no convencionales) y del signo igual (relación de equivalencia e igualdad condicionada) y los utiliza para argumentar equivalencias entre expresiones algebraicas y resolver sistemas de ecuaciones.


Utiliza y explica diferentes estrategias para encontrar el volumen de objetos regulares e irregulares en la solución de problemas en las matemáticas y en otras ciencias.


Describe atributos medibles de diferentes sólidos y explica relaciones entre ellos por medio del lenguaje algebraico

";"
Reconoce el uso del signo igual como relación de equivalencia de expresiones algebraicas en los números reales


Estima medidas de volumen con unidades estandarizadas y no estandarizadas. 
Utiliza la relación de las unidades de capacidad con las unidades de volumen (litros, dm3, etc) en la solución de un problema.


Utiliza lenguaje algebraico para representar el volumen de un prisma en términos de sus aristas. 
Realiza la representación gráfica del desarrollo plano de un prisma.
Estima, calcula y compara volúmenes a partir de las relaciones entre las aristas de un prisma o de otros sólidos. 
Interpreta las expresiones algebraicas que representan el volumen y el área cuando sus dimensiones varían";Productos y cocientes notables, el triángulo de pascal, concepto de factorización, factorización de monomios , binomios y polinomios
"• Utilizo la notación científica para representar medidas de
cantidades de diferentes magnitudes.
• Identifico y utilizo la potenciación, la radicación y la logaritmación
para representar situaciones matemáticas y no
matemáticas y para resolver problemas.";9;3;1;Utiliza los números reales, sus operaciones, relaciones y representaciones para analizar procesos infinitos y resolver problemas.;"Encuentra las relaciones y propiedades que determinan la formación de secuencias numéricas. 
Determina y utiliza la expresión general de una sucesión para calcular cualquier valor de la misma y para compararla con otras sucesiones.


Considera el error que genera la aproximación de un número real a partir de números racionales. 
Identifica la diferencia entre exactitud y aproximación en las diferentes representaciones de los números reales. Construye representaciones geométricas y numéricas de los números reales (con decimales, raíces, razones, y otros símbolos) y realiza conversiones entre ellas.";Potenciación y radicación, potenciación de números reales,  notación científica, propiedades de la radicación, operaciones con radicales, racionalización,  representación gráfica de los números complejos, conjugado de un número, operación con números complejos, sucesiones y series, sucesiones recursivas, sucesiones aritméticas, sucesiones geométricas, sumatoria
"Analizo las relaciones y propiedades
entre las expresiones algebraicas y
las gráfi cas de funciones polinómicas
y racionales y de sus derivadas
.";10;3;1;"Comprende y usa el concepto de razón de cambio para estudiar el cambio promedio y el cambio alrededor de un punto y lo reconoce en representaciones gráficas, numéricas y algebraicas.


Resuelve problemas mediante el uso de las propiedades de las funciones y usa representaciones tabulares, gráficas y algebraicas para estudiar la variación, la tendencia numérica y las razones de cambio entre magnitudes.


Explora y describe las propiedades de los lugares geométricos y de sus transformaciones a partir de diferentes representaciones.



Comprende y usa el concepto de razón de cambio para estudiar el cambio promedio y el cambio alrededor de un punto y lo reconoce en representaciones gráficas, numéricas y algebraicas";"Utiliza representaciones gráficas o numéricas para tomar decisiones, frente a la solución de problemas prácticos. Determina la tendencia numérica en relación con problemas prácticos como predicción del comportamiento futuro. Relaciona características algebraicas de las funciones, sus gráficas y procesos de aproximación sucesiva.


Utiliza representaciones gráficas o numéricas para tomar decisiones en problemas prácticos. ";Trigonometría y geometría analítica , definición de identidades trigonométricas, identidades fundamentales, identidades para la suma de ángulos, identidades trigonométricas para ángulos medios, ecuaciones trigonométricas, ecuaciones trigonométricas lineales, ecuaciones trigonométricas en forma factor izada, ecuaciones trigonométricas con funciones inversas, distancia entre dos puntos, la circunferencia, ecuación canónica, posición relativa de dos circunferencias en el plano, problemas d aplicación , la parábola, la elipse, la hipérbola, 
"
Utilizo las técnicas de aproximación en procesos infinitos numéricos. • Interpreto la noción de derivada como razón de cambio y como valor de la pendiente de la tangente a una curva y desarrollo métodos para hallar las derivadas de algunas funciones básicas en contextos matemáticos y no matemáticos


















.";11;3;1;Usa propiedades y modelos funcionales para analizar situaciones y para establecer relaciones funcionales entre variables que permiten estudiar la variación en situaciones extraescolares y extraescolares;"•	Plantea modelos funcionales en los que identifica variables y rangos de variación de las variables.
•	Relaciona el signo de la derivada con características numéricas, geométricas y métricas.
•	Utiliza la derivada para estudiar la variación y relaciona características de la derivada con características de la función.
Relaciona características algebraicas de las funciones, sus gráficas y procesos de aproximación sucesiva";Limites y continuidad definición formal de limite, limites laterales,, limites de funciones trigonométricas, clases de límites, funciones continuas, discontinuidades,
"•	Reconoce mi potencial biológico y psíquico para realizar tareas motrices.
•	Mantiene vigentes sus habilidades motrices que me permiten explorar y adaptarse al medio

•	Incrementa mis capacidades físicas en un contexto de respeto y valoración de la vida y el cuerpo humano";6;3;4;"•	identifica algunas consecuencias ambientales en mi salud derivadas del mal uso que le damos  a las basuras cuando estamos en un campo de juego.
•	Participa en equipos de trabajo para desarrollar distintas actividades que le permitan darse cuenta cuáles son sus capacidades físicas";"•	Identifico medios para valorar y mi estado físico
•	Reconozco distintos métodos para valorar mi estado físico
•	Reconozco las ventajas y beneficios del calentamiento
•	Clasifico los deportes de acuerdo a características o recursos para mi desarrollo
•	Domino los conceptos sobre capacidades físicas";"•	Medición y evaluación diagnóstica
•	Test psicomotores
•	Concepto y finalidad del calentamiento
•	Capacidades físicas básicas
•	Deportes individuales, atletismo ajedrez, natación"
"•	Reconoce las diferencias personales y el carácter único del ser humano y lo respeta.
•	Acepta y comprende las limitaciones físicas, sensoriales y cognitivas en sus compañeros.
•	Interactúa motrizmente con sus compañeros para el logro de sus actividades de clase.";7;3;4;"•	Conoce el concepto de reglas y normas de los juegos básicos y predeportivos.
•	Identifica diferentes conceptos de formación deportiva básica.";"•	Conceptualiza sobre las capacidades físicas a través de diferentes medios de consulta.
•	Identifica pruebas físicas para valorar su estado deportivo.
•	Reconoce juegos y deportes de pelota por medio de trabajo en equipo.
•	Domina los fundamentos básicos del voleibol y tenis de mesa y acata sus reglas de juego";"•	Pruebas físicas
•	Practica de juegos organizados predeportivos.
•	Formación deportiva básica."
"•	Reconoce las diferencias individuales y el carácter único de cada persona y se integra con facilidad a través de actividades lúdicas y/o.";8;3;4;"•	Conoce los conceptos básicos de rítmica aplicada a diferentes actividades deportivas y lúdicas.";"•	Adquiere conocimientos sobre ritmos y bailes de la región Andina
•	Realiza actividades deportivas como caminatas y ciclo paseos donde se reconozca la riqueza natural de la vereda y las oportunidades de conservación por parte de la comunidad  ";"•	Concepto de: Juego
•	Lúdica
•	Recreación
•	Deporte
•	Gimnasia
•	Aeróbicos
•	Caminatas
•	Ciclo paseos
•	Expresiones Rítmico Danzarías"
"•	Recupera, conserva y mejora el ambiente como escenario propicio para la práctica de actividad física.
•	Reconoce las diferencias individuales y el carácter único de cada persona y se integra con facilidad a través de actividades lúdicas y/o deportivas.
•	Realiza de manera sistemática ejercicio físico para el mejoramiento de las funciones orgánicas y corporales.
•	Participa en la creación de normas de juego y las tengo en cuenta para las actividades programadas en clase";9;3;4;"•	Reconoce la importancia de un ambiente limpio y seguro para la práctica de actividad física y participa activamente en su conservación.
•	Implementa prácticas de reciclaje y reducción de residuos en el entorno escolar y comunitario para mantener un espacio propicio para la actividad física";"•	Reconoce los movimientos articulares que se realizan en el cuerpo humano.
•	Diferencia los test que permiten evaluar cada una de las capacidades físicas.
•	Identifica fundamentos básicos de la condición física para aplicarlos en el entrenamiento.
•	Identifica factores y características colectivas determinantes de los deportes de conjunto.
•	Clasifica los sistemas de eliminación de acuerdo con características de los participantes y del entorno.
•	Reconocer la importancia de mantener los escenarios deportivos y espacios utilizados para realizar actividades físicas limpios preservando su buen estado. ";"•	Movimientos articulares.
•	Test de aptitud física.
•	Fundamentos Básicos de la condición física: Carga y Adaptación."
"•	Aplica las capacidades físicas y habilidades motrices a las situaciones reales de aspectos técnico-tácticos normativos
•	Incorpora en mis hábitos diarios la practica regular y sistemática de un programa de ejercicios para mantener mi salud física y mental.";10;3;4;Desarrollar la capacidad de aplicar habilidades motrices en contextos reales y fomentar la práctica regular de ejercicios para el bienestar físico y mental.;"•	Comprende y diferencia el concepto de las distintas estrategias socializadoras.
•	Identifico en las diversas manifestaciones del juego medios de satisfacción y desarrollo personal
•	Valora las expresiones lúdicas y de recreación como dimensiones del ser humano que proporcionan satisfacción y descanso.
•	Descubre las diversas posibilidades de integración, socialización y convivencia a través del deporte";"•	Conceptos de Juego
•	Lúdica
•	Recreación y Deporte
•	Manifestaciones del juego.
•	Manifestaciones de la lúdica y la recreación
•	Manifestaciones del deporte"
"•	Aplica las capacidades físicas y habilidades motrices a las situaciones reales de aspectos técnico-tácticos normativos
•	Incorpora en mis hábitos diarios la practica regular y sistemática de un programa de ejercicios para mantener mi salud física y mental";11;3;4;;"•	Reconoce la importancia de los test físicos y los métodos de entrenamiento para el mejoramiento del estado físico.
•	Relaciona la condición física con la capacidad física del individuo.
•	Caracteriza los fundamentos técnico-tácticos del fútbol y la natación.
•	Emplea los conocimientos de administración y organización deportiva en las prácticas deportivas.
•	Lidera campañas de preservación y conservación del medio ambiente";"•	Condición física
•	Bases del entrenamiento deportivo.
•	Test funcionales
•	Deportes básicos: Fútbol y natación y deportes alternativos: 
•	Administración y organización deportiva"
